This image was saved from this machine with hard drive S.M.A.R.T. info at 2026-0906-0000:
*****************************************************.
For the drive: /dev/sda
smartctl 7.4 2023-08-01 r5530 [x86_64-linux-6.8.0-117-generic] (local build)
Copyright (C) 2002-23, Bruce Allen, Christian Franke, www.smartmontools.org

=== START OF INFORMATION SECTION ===
Model Family:     Marvell based SanDisk SSDs
Device Model:     SanDisk SSD PLUS 1000GB
Serial Number:    19360S477706
LU WWN Device Id: 5 001b44 4a8c9498c
Firmware Version: UH5100RL
User Capacity:    1,000,207,286,272 bytes [1.00 TB]
Sector Size:      512 bytes logical/physical
Rotation Rate:    Solid State Device
Form Factor:      2.5 inches
TRIM Command:     Available, deterministic
Device is:        In smartctl database 7.3/5528
ATA Version is:   ACS-2 T13/2015-D revision 3
SATA Version is:  SATA 3.2, 6.0 Gb/s (current: 6.0 Gb/s)
Local Time is:    Sun Sep  6 00:00:18 2026 UTC
SMART support is: Available - device has SMART capability.
SMART support is: Enabled

=== START OF READ SMART DATA SECTION ===
SMART overall-health self-assessment test result: PASSED

General SMART Values:
Offline data collection status:  (0x00)	Offline data collection activity
					was never started.
					Auto Offline Data Collection: Disabled.
Self-test execution status:      (   0)	The previous self-test routine completed
					without error or no self-test has ever 
					been run.
Total time to complete Offline 
data collection: 		(  120) seconds.
Offline data collection
capabilities: 			 (0x15) SMART execute Offline immediate.
					No Auto Offline data collection support.
					Abort Offline collection upon new
					command.
					No Offline surface scan supported.
					Self-test supported.
					No Conveyance Self-test supported.
					No Selective Self-test supported.
SMART capabilities:            (0x0003)	Saves SMART data before entering
					power-saving mode.
					Supports SMART auto save timer.
Error logging capability:        (0x01)	Error logging supported.
					General Purpose Logging supported.
Short self-test routine 
recommended polling time: 	 (   2) minutes.
Extended self-test routine
recommended polling time: 	 ( 182) minutes.

SMART Attributes Data Structure revision number: 1
Vendor Specific SMART Attributes with Thresholds:
ID# ATTRIBUTE_NAME          FLAG     VALUE WORST THRESH TYPE      UPDATED  WHEN_FAILED RAW_VALUE
  5 Reallocated_Sector_Ct   0x0032   100   100   000    Old_age   Always       -       0
  9 Power_On_Hours          0x0032   100   100   000    Old_age   Always       -       23008
 12 Power_Cycle_Count       0x0032   100   100   000    Old_age   Always       -       2241
165 Total_Write/Erase_Count 0x0032   100   100   000    Old_age   Always       -       6535
166 Min_W/E_Cycle           0x0032   100   100   ---    Old_age   Always       -       12
167 Min_Bad_Block/Die       0x0032   100   100   ---    Old_age   Always       -       0
168 Maximum_Erase_Cycle     0x0032   100   100   ---    Old_age   Always       -       58
169 Total_Bad_Block         0x0032   100   100   ---    Old_age   Always       -       888
170 Unknown_Marvell_Attr    0x0032   100   100   ---    Old_age   Always       -       0
171 Program_Fail_Count      0x0032   100   100   000    Old_age   Always       -       0
172 Erase_Fail_Count        0x0032   100   100   000    Old_age   Always       -       0
173 Avg_Write/Erase_Count   0x0032   100   100   000    Old_age   Always       -       12
174 Unexpect_Power_Loss_Ct  0x0032   100   100   000    Old_age   Always       -       63
184 End-to-End_Error        0x0032   100   100   ---    Old_age   Always       -       0
187 Reported_Uncorrect      0x0032   100   100   000    Old_age   Always       -       47536
188 Command_Timeout         0x0032   100   100   ---    Old_age   Always       -       0
194 Temperature_Celsius     0x0022   053   072   000    Old_age   Always       -       47 (Min/Max 5/72)
199 SATA_CRC_Error          0x0032   100   100   ---    Old_age   Always       -       0
230 Perc_Write/Erase_Count  0x0032   100   100   000    Old_age   Always       -       4675 552 4675
232 Perc_Avail_Resrvd_Space 0x0033   100   100   005    Pre-fail  Always       -       100
233 Total_NAND_Writes_GiB   0x0032   100   100   ---    Old_age   Always       -       12499
234 Perc_Write/Erase_Ct_BC  0x0032   100   100   000    Old_age   Always       -       102105
241 Total_Writes_GiB        0x0030   100   100   000    Old_age   Offline      -       36112
242 Total_Reads_GiB         0x0030   100   100   000    Old_age   Offline      -       28811
244 Thermal_Throttle        0x0032   000   100   ---    Old_age   Always       -       0

SMART Error Log Version: 1
No Errors Logged

SMART Self-test log structure revision number 1
Num  Test_Description    Status                  Remaining  LifeTime(hours)  LBA_of_first_error
# 1  Short offline       Fatal or unknown error        80%     22852         0
# 2  Short offline       Fatal or unknown error        80%     22708         0
# 3  Short offline       Self-test routine in progress 80%     22708         -
# 4  Short offline       Fatal or unknown error        80%     22572         0
# 5  Short offline       Fatal or unknown error        80%     22432         0
# 6  Short offline       Self-test routine in progress 90%     22432         -
# 7  Short offline       Self-test routine in progress 90%     22432         -
# 8  Short offline       Fatal or unknown error        80%     22317         0
# 9  Short offline       Fatal or unknown error        80%     22208         0
#10  Short offline       Fatal or unknown error        80%     22097         0
#11  Short offline       Self-test routine in progress 90%     22097         -
#12  Short offline       Self-test routine in progress 90%     22097         -
#13  Short offline       Fatal or unknown error        80%     21985         0
#14  Short offline       Self-test routine in progress 90%     21985         -
#15  Short offline       Self-test routine in progress 90%     21985         -
#16  Short offline       Self-test routine in progress 90%     21985         -
#17  Short offline       Self-test routine in progress 90%     21985         -
#18  Short offline       Self-test routine in progress 90%     21985         -
#19  Short offline       Self-test routine in progress 90%     21985         -
#20  Short offline       Self-test routine in progress 90%     21985         -
#21  Short offline       Self-test routine in progress 90%     21985         -

Selective Self-tests/Logging not supported

The above only provides legacy SMART information - try 'smartctl -x' for more

